{
  "export_id": "dexp_6a532cbd33413ee8f86efa85",
  "generated_at": "2026-10-20T12:01:15.000Z",
  "kind": "fundedflow.collector.directory_observations",
  "notice": "Unverified third-party observations from prop-firm comparison publishers. They are not rules, not official firm data and not approved; publisher ratings, rankings and offers are excluded.",
  "pages": [
    {
      "adapter_version": "1.0.0",
      "captured_at": "2026-10-20T12:00:05.000Z",
      "content_hash": "sha256:49862a8a6cc4599eaedbfa0e4e95425625d6f93bb782bbd59a48fb9b1dde045e",
      "detail": "the list is filled in by JavaScript; use the browser or capture it",
      "extraction_status": "js_unavailable",
      "last_attempt_at": "2026-10-20T12:00:05.000Z",
      "last_outcome": "new_snapshot",
      "page_kind": "comparison",
      "page_state": "js_unavailable",
      "publisher_key": "onlypropfirms",
      "record_count": 0,
      "snapshot_id": "snap_82e8e82225a50fba325c4b92d24cc51f",
      "url": "https://onlypropfirms.com/largest-drawdown",
      "warnings": []
    },
    {
      "adapter_version": "1.0.0",
      "captured_at": "2026-10-20T12:00:10.000Z",
      "content_hash": "sha256:7f1c86bd45f5d56da2eb2f1ac76dd649cd9ebb99196707a16efd8f12ba91631c",
      "detail": null,
      "extraction_status": "collected",
      "last_attempt_at": "2026-10-20T12:00:10.000Z",
      "last_outcome": "new_snapshot",
      "page_kind": "comparison",
      "page_state": "collected",
      "publisher_key": "onlypropfirms",
      "record_count": 4,
      "snapshot_id": "snap_be58a2f1b6308eca5df1c51cee07f0bd",
      "url": "https://onlypropfirms.com/prop-firm-comparison",
      "warnings": [
        "table 0: not read: Deal (affiliate offer, coupon or checkout, not a rule), Rating (editorial rating or ranking, not a rule)"
      ]
    },
    {
      "adapter_version": "1.0.0",
      "captured_at": "2026-10-20T12:00:25.000Z",
      "content_hash": "sha256:31d48728c506d599c29e6ceab7ea7a631dc4c3a55212b10767160267a00c464e",
      "detail": null,
      "extraction_status": "collected",
      "last_attempt_at": "2026-10-20T12:00:25.000Z",
      "last_outcome": "new_snapshot",
      "page_kind": "comparison",
      "page_state": "collected",
      "publisher_key": "onlypropfirms",
      "record_count": 1,
      "snapshot_id": "snap_8e5469325615523fd5dc39fbffedc821",
      "url": "https://onlypropfirms.com/prop-firm-comparison?page=2",
      "warnings": [
        "table 0: not read: Deal (affiliate offer, coupon or checkout, not a rule), Rating (editorial rating or ranking, not a rule)"
      ]
    },
    {
      "adapter_version": "1.0.0",
      "captured_at": "2026-10-20T12:00:15.000Z",
      "content_hash": "sha256:230b70b994417e2911811cb5e551b74f1cd252c44a5e312c3d85bde65cf3498d",
      "detail": null,
      "extraction_status": "collected",
      "last_attempt_at": "2026-10-20T12:00:15.000Z",
      "last_outcome": "new_snapshot",
      "page_kind": "comparison",
      "page_state": "collected",
      "publisher_key": "onlypropfirms",
      "record_count": 1,
      "snapshot_id": "snap_49bb1a199dcad07c256319e770517319",
      "url": "https://onlypropfirms.com/prop-firm-starting-costs",
      "warnings": [
        "table 0: not read: Deal (affiliate offer, coupon or checkout, not a rule)"
      ]
    },
    {
      "adapter_version": "1.0.0",
      "captured_at": "2026-10-20T12:00:20.000Z",
      "content_hash": "sha256:c1a276e99582585b3098179973f7543c0b3d995e0910e06d48bc57831b8d2700",
      "detail": null,
      "extraction_status": "collected",
      "last_attempt_at": "2026-10-20T12:00:20.000Z",
      "last_outcome": "new_snapshot",
      "page_kind": "listing",
      "page_state": "collected",
      "publisher_key": "onlypropfirms",
      "record_count": 2,
      "snapshot_id": "snap_630bb50edfb3a63d1efeb5d71243ad9b",
      "url": "https://onlypropfirms.com/prop-firms",
      "warnings": [
        "table 0: not read: Discount Code (affiliate offer, coupon or checkout, not a rule), True Cost to Funding (the publisher's own calculation, not a displayed rule)"
      ]
    },
    {
      "adapter_version": "1.0.0",
      "captured_at": "2026-10-20T12:00:35.000Z",
      "content_hash": "sha256:af36c80967d4416cf38b7d43b95964f4ed35e03883abe13fef946e58469203e3",
      "detail": "table 0: unexpected column 'Platform'",
      "extraction_status": "structure_changed",
      "last_attempt_at": "2026-10-20T12:00:35.000Z",
      "last_outcome": "new_snapshot",
      "page_kind": "profile",
      "page_state": "structure_changed",
      "publisher_key": "onlypropfirms",
      "record_count": 0,
      "snapshot_id": "snap_67ce9c0e2303a72f1b014033452a42a4",
      "url": "https://onlypropfirms.com/prop-firms/contoso-funding",
      "warnings": []
    },
    {
      "adapter_version": "1.0.0",
      "captured_at": "2026-10-20T12:00:40.000Z",
      "content_hash": "sha256:9ce65084b0b79fa4bc6cf4f3d653f87aed4435f7f77a7119b7f80cb139415dea",
      "detail": null,
      "extraction_status": "collected",
      "last_attempt_at": "2026-10-20T12:00:40.000Z",
      "last_outcome": "new_snapshot",
      "page_kind": "profile",
      "page_state": "collected",
      "publisher_key": "onlypropfirms",
      "record_count": 1,
      "snapshot_id": "snap_3280d7b9197d54a646e90943532382f5",
      "url": "https://onlypropfirms.com/prop-firms/fabrikam-traders",
      "warnings": []
    },
    {
      "adapter_version": "1.0.0",
      "captured_at": "2026-10-20T12:00:30.000Z",
      "content_hash": "sha256:689c2e8458d6148ac2031b1a3adc8abc70cb2e25da7be86be8ba3b545492c3b1",
      "detail": null,
      "extraction_status": "collected",
      "last_attempt_at": "2026-10-20T12:00:30.000Z",
      "last_outcome": "new_snapshot",
      "page_kind": "profile",
      "page_state": "collected",
      "publisher_key": "onlypropfirms",
      "record_count": 2,
      "snapshot_id": "snap_478380a55d2d3a96364efaf1794565dd",
      "url": "https://onlypropfirms.com/prop-firms/northwind-futures",
      "warnings": []
    },
    {
      "adapter_version": "1.0.0",
      "captured_at": "2026-10-20T12:00:45.000Z",
      "content_hash": "sha256:2d25b9f38c179ff4f3f70226bfb3682c65e55a87a8dc4050b9e2e1937946d02c",
      "detail": null,
      "extraction_status": "collected",
      "last_attempt_at": "2026-10-20T12:00:45.000Z",
      "last_outcome": "new_snapshot",
      "page_kind": "profile",
      "page_state": "collected",
      "publisher_key": "onlypropfirms",
      "record_count": 1,
      "snapshot_id": "snap_0777392a11c8f8ca5ae4ed2bbfbaa0b2",
      "url": "https://onlypropfirms.com/prop-firms/tailspin-capital",
      "warnings": []
    },
    {
      "adapter_version": null,
      "captured_at": null,
      "content_hash": null,
      "detail": null,
      "extraction_status": "not_read",
      "last_attempt_at": null,
      "last_outcome": null,
      "page_kind": null,
      "page_state": "never_collected",
      "publisher_key": "propfirmmatch-futures",
      "record_count": 0,
      "snapshot_id": null,
      "url": "https://propfirmmatch.com/futures",
      "warnings": []
    },
    {
      "adapter_version": "1.0.0",
      "captured_at": "2026-10-21T12:00:00.000Z",
      "content_hash": "sha256:a91459b3f3851ea8dad677ffe623ba42e8fdf244af83e994fd1984315de8e7bb",
      "detail": null,
      "extraction_status": "collected",
      "last_attempt_at": "2026-10-21T12:00:00.000Z",
      "last_outcome": "new_snapshot",
      "page_kind": "comparison",
      "page_state": "collected",
      "publisher_key": "propfirmmatch-futures",
      "record_count": 3,
      "snapshot_id": "snap_9bcc167c8d76109368484cd966200b21",
      "url": "https://propfirmmatch.com/futures/prop-firm-challenges",
      "warnings": [
        "table 0: not read: Discount (affiliate offer, coupon or checkout, not a rule), Rating (editorial rating or ranking, not a rule)"
      ]
    },
    {
      "adapter_version": "1.0.0",
      "captured_at": "2026-10-20T12:01:15.000Z",
      "content_hash": "sha256:8b36bdaea667f38bbab58892ede857a8d2f836439adaada8966b54331c1cd795",
      "detail": null,
      "extraction_status": "collected",
      "last_attempt_at": "2026-10-20T12:01:15.000Z",
      "last_outcome": "new_snapshot",
      "page_kind": "rules_guide",
      "page_state": "collected",
      "publisher_key": "traderssecondbrain",
      "record_count": 1,
      "snapshot_id": "snap_686a4ab184fb1f748b1bd3b15f9dc592",
      "url": "https://traderssecondbrain.com/guides/northwind-futures-review",
      "warnings": [
        "guide labels not read: Rule, Trading platforms"
      ]
    },
    {
      "adapter_version": "1.0.0",
      "captured_at": "2026-10-20T12:01:05.000Z",
      "content_hash": "sha256:2f6f7a078a8cbc0f93ac57ab93f2c0c9ceb5b30f2544435c2dfa75d6d63e6ebb",
      "detail": "the expected table or section was not found",
      "extraction_status": "structure_changed",
      "last_attempt_at": "2026-10-20T12:01:05.000Z",
      "last_outcome": "new_snapshot",
      "page_kind": "profile",
      "page_state": "structure_changed",
      "publisher_key": "traderssecondbrain",
      "record_count": 0,
      "snapshot_id": "snap_c5c29ff0b4e22a0a56dcc7b92f712d62",
      "url": "https://traderssecondbrain.com/prop-firm/contoso",
      "warnings": []
    },
    {
      "adapter_version": "1.0.0",
      "captured_at": "2026-10-20T12:01:10.000Z",
      "content_hash": "sha256:78a4883d7fbb5416de344f713180140f53a398435688fd26e9c616e073bc3a30",
      "detail": null,
      "extraction_status": "collected",
      "last_attempt_at": "2026-10-20T12:01:10.000Z",
      "last_outcome": "new_snapshot",
      "page_kind": "profile",
      "page_state": "collected",
      "publisher_key": "traderssecondbrain",
      "record_count": 1,
      "snapshot_id": "snap_2f02b5843f0a31705ee49e0f5196a1e0",
      "url": "https://traderssecondbrain.com/prop-firm/fabrikam-traders-llc",
      "warnings": []
    },
    {
      "adapter_version": "1.0.0",